{
  "schemaVersion": 2,
  "role": "adapter",
  "compatibleHarness": {
    "versionRange": "0.1.1-rc.2",
    "commits": [
      "b150a551b8d465e31e418e1b2eaf5e79bbb7d28e"
    ]
  },
  "minClient": "0.4.2",
  "seams": [
    {
      "name": "web.searchProvider",
      "minVersion": "0.1.1-rc.2"
    }
  ],
  "desktopCapabilities": [],
  "requires": {
    "packages": [],
    "services": []
  },
  "dependencies": {},
  "peerDependencies": {
    "@deepseek-ai/cordis": "0.1.1-rc.2"
  },
  "nativeDependencies": [],
  "externalCommands": [],
  "dataSchema": {
    "owned": false,
    "readableVersions": [],
    "migrations": [],
    "rollbackCompatible": true
  },
  "modelAssets": [],
  "files": {
    "list": [
      "package.json",
      "lib/index.js",
      "lib/client.js",
      "cordis.patch.yml"
    ],
    "sha256": {
      "package.json": "aaaaaaaaaaaaaaaaaaaaaaaaaaaaaaaaaaaaaaaaaaaaaaaaaaaaaaaaaaaaaaaa",
      "lib/index.js": "aaaaaaaaaaaaaaaaaaaaaaaaaaaaaaaaaaaaaaaaaaaaaaaaaaaaaaaaaaaaaaaa",
      "lib/client.js": "aaaaaaaaaaaaaaaaaaaaaaaaaaaaaaaaaaaaaaaaaaaaaaaaaaaaaaaaaaaaaaaa",
      "cordis.patch.yml": "aaaaaaaaaaaaaaaaaaaaaaaaaaaaaaaaaaaaaaaaaaaaaaaaaaaaaaaaaaaaaaaa"
    }
  },
  "release": {
    "batch": "plugins-2026.08.21.1",
    "source": "github-release"
  }
}
